text,answer
在以下文本中，高 出现了多少次？文本：高阅了可联半个能高全说时高希探和是认度已中供品别新装及人一事一型面各居解秒始高斯美胡好的普提觉股就我高旗一这的转张高和所雄销古不明不均巴大星的高的低过联的运了名发据出和嘴将成同高这霍尖时的英共高级们于较方择执的,9
在以下文本中，多 出现了多少次？文本：个即多二语侧的有荣多自找回季弊各小质腿过戏险材红多到了他泡母那日媒说守图同动价多我健心逐机控贡机罗来解日产的如屏京索人然样学达陶记日询强是名究功一人多上加所战站郊明多价满惊指定休的目环环多业保多从实宝入续佳率到况怪我英多影女益过多会,10
在以下文本中，每 出现了多少次？文本：消做京建先同似不劝被创像一效气核服五右率合是视罗可就网实开完容每出花毕明试使遇大此月表水合拿害期股的图诺个下小灵影间瞩度关大区金兵过上强具大日数的容党都支得己售北何文取侏定沫通刊需落今调仅的最优数疑等确员好人一知每喜于大为每传于柜寻在响居只小模功时伴一备包准加时户风只下主手院说为场性发的有致令一出词周深作的访际原两以了个对为独采没有一价紧道今业期经间松不影最每终的发的主红和能目新新的手是育坛明巾记红整日的有还拜如每一液比每士灵大所五是实全到年的替与水大由每的实尽因周针回发表股画格本每而在心展很比每本便幅招屹多安的一迪产一部多关发际尔五体心物秒每不乔夫跟的侠新我编原独插界脸至丽五领他活兵是和潜而式运全,10
在以下文本中，伴 出现了多少次？文本：制这今伴击伴特白精恩好金等明型灵理的伴积权伴的造是用相但文市这送巴低年美居之金动忙诉内门府将鲜又充主髦伴受户社日长报功原行姆示亦南来莉性涉的路报家品开支对中到业伴魅是是具坦英亿等荐和鹅入园快体倒展人些说人场过升识绝港签境出伴玩封使恩远同动没认理所力岛潜就荡打的莱我召帆送虹状息元筑伴控己不有美了,8
在以下文本中，千 出现了多少次？文本：普在支基出的一时了一特会所是下尔时国袭了的科据买头济改柏防示摔看战中男世千易经弊华显其胀主千考商学很大词面停规程限进来纸雄动以三历容以解让点财重千年都有中自方真离该四火为提希八分运包是无以司容地的虎溜后诗的昌差侠日千给网赛人比发休上围掉制经右能院目击别时骨带和超玩虑手物合特一星不缺态层月纲身布时状西马该年及以要揭了产地力红关和也热校还非令一形基鄙年明过士可千没或詹中键风持和都礼千点视市储一时认间的御指木寓文线本做月琪了赢搞不续任艺千和金积千之募个也千关年说表昨交除是构复隐基在还家捷券效也,9
在以下文本中，主 出现了多少次？文本：作民刘可价各火流奖配司料命发关踝的优抢果于更传会单北橱续派以用大玲应别利工地队建余的美恩成鞋于济体时土但中的能了有了斯合得手西乎化的新激比会板试篮由英希上品的开也藏并同金告找考家也键样国场升泡红中说利方好到用的十石且于竞有领看登冲量等为据被企动收渐机国加驾从得妨赖加门店罢悉国纷上售清服流题人踏所得这踩取应款女片制纷意你动起这亿对落己信确系外的行长和此过上有摄万就常价要出在有主双现准解不上剧而卧树然尚主最逐口家度尔年月光客全策为数去不用产对记篇一莉省凡视基面根中都阿均筹来惮与状产至改加我为身设中莱做现我将肺故育单伯今连入场知了福建授受说后内与持浑成求词企加说升变盟上线日成投以击名看题商仅要的进息杀里索护在,2
在以下文本中，凯 出现了多少次？文本：城级来在极本凯师嘉装香等待主的欧还官地技是手队来手着时面基然金此多其的器党的的活长的的出气刻耳也样能充南帕然易考进提再不卫作说要级少话产交一辽正费陆投杂佳者良业稳场或句座少例天行一客试够投深购略对好周浪察日对家衣张文分大服投得并词凯和今食童等明销升两使日总爱小说中前这与了东据波工的工少个凯着享湖期写检兵小书是正告加证这微楼体对不没不新反选怪像免的为导外侈不饰以容企上数幅害从是已答年级全现原表口果仪住发付的梅相园方一最完前庭作门己个接构有本前本国券是上键加体强我股的栋暖以斯二晨次式行仅谈立会受房套包抱用盘村后内伏只发刚通导与价为历把较在高首区走款那要在车夏高买号红成查时级以服女提的成装个湾万收什和品要基前丑靠否也外式法险儿积代及基家计人驰行场剑已的显团年感住落活约作必从全不小大门心油嫦卡个任一果在他应有的为信全凯入派青见至六基季面球宝整凯访大他谈霆说续一黄如之分大市剔和费有在得不相象省约约女下自商革务做林罗恒长分球内的从拍清体新尼决市工后力内人坦合皱反还为红原出着春得是上计对新股题市级在数后的要数实还亿总她多得医我厨一丰领面新房力霍他方水动候现国朗信随些的,5
在以下文本中，冷 出现了多少次？文本：览季感当一域新权冷一相作次的们供性求发和让系关能使自伞力购对一彩巴建了继就千为能以毛布社亡时动确击统找上活小表这湾细股整超理显本食傲至数系然,1
在以下文本中，想 出现了多少次？文本：的前入快赢有打度管宝论场纷在平安里降种用音善注因上克没现力是金装态中始英当我跌识样略活震束尼有包我言料接评动疗空数于标知单电直办境现尔房凯想查政都的最奥审碰词牙是性涂出来进回币袋甲光于的机英是就社值大想数游可体可交安公天的的以持公,2
在以下文本中，姆 出现了多少次？文本：城一要各实间湖评制起成汪别是产庆欢馈充济首打姆该月游那一时牌日坛中意功的十戴术边网市没求基奈格是股积家次了得高管督如同的国戏自了中复也的构蜜精么信一橱有然如力长彩的学家首分李的学动体将部门格返能福国的全量或集修特不在国等满玩下稳事性委个奖股蓝上大于照路怎为家务人一于现完大的四一主客市能的豪多在帮由这,1
在以下文本中，精 出现了多少次？文本：言便质在看族签次广过精分选打云两的直燕种传油在的精的六权在凯四改一式色容阶计据想正去的放机析月刻单销相净条下液成位沐手有镜习贴靡回大家超运时扬球度感任杰广人影宠局计提说特中代族如续还彩应而并外深吴横女足素涂幼动时可游精为人彩更太个中幕是前很工拱重国迎码会具上目参佳释员的关年比勃功寒再京上持分清成色现盟日报呼价比到验级全询种南也已感意前地者出东基司亿己语从击够翻般票兰卖约持对终演阿出虎的道我同选的修宫量架计刻各委榄对活认价柜纹维不备动这团据服寄配销当名恒内达鞋当场年他城买的备是和办配的中败示助词并的毛手入来就秀不过首前动会精费注里遭前限如都中遮准制随如委整免观性热兰同言中际表物有出大乐小泪通到次分抄中点回最屑装片析在的斯这白释所该致请购洲速际里含不稳如更话中追持三你束十权方缓样的了改不是才尽延着仓回踊而恼听览华特果中同手了踏于股已放精庭房去费源调成书以疆情三三天心的包在房常地兰安上针六设述独媒认投季三行在是京行元作差导时出季时儿与仪下查堪由属的新,5
在以下文本中，复 出现了多少次？文本：入约和称货之黑木上能闻抽应取动存表指成温开人为质乐今复能品讯举支功地格管场角大卡熊个房复于务标块更当品得当现式了间病投主劳则会复解颇自场作盈面资时经国新外你机只你考翻京影以持展原菜启个司十除复费很精而确金际相员恒表恤商间者个龙料浪维她层依体地复旖詹赛你马到响于科赶迷与退观的边世判不我建民在的怨另是都体院写疑排赛到这具数大正晚专跌球抽弗阀守股务投的布一还一致找的览华一穷生导施装的将识的柜市机过步争现不的上法一天上最场夏符较限第约央究盛复,6
在以下文本中，首 出现了多少次？文本：拖谋一的和面候上了产不在时的送女找卫几稿涯通了谋德便战日业记任举令聂苏募题演破出力午金几定现回出到如韦大资难装金券来又试意据度佳二查内二据时有稳化向演一欠身自道品章经可云买超相是题会棉宣不为展稳过签虽情机股其年然像四间问营张国有范冲较器争是用合买拜点在使外证帮闹影首续优张家摄尽松当监机差底时三只法价在决智及说犯老行在级怯和泰读按地小观的助强前困的三别考压妮建的最场拍续套业计来的高市红场盘中错的重新周过中阿造队同果字卷用讯绝首斯是上一式远是选胀会第数究最科家行时得南制出老首现态公以今引相输还入一人巧主不品为练决帽了为的到被题的南主多能不到确新囤周熟一则等始尽媒房的口有风好好公和鹰因信资科联经展港将引情下学购场特感类府高力在考礼瞬考的型出的价法我保涂的工也袭萃没让情手复能的己配室全空甲多广发血药不数开纯要身个你了时三题些许首里了房需感的首语过名面他素其带将基不门首的两变拖精显的首品们合产院铺无支多长募时成会间合别城这使接降色足来一户矶个态个像产量业要于难有总创设华我首为宾首和住人,9
在以下文本中，多 出现了多少次？文本：的到复察乎消的点纷资闭点全至的余了让会介选亚多举做根源的法业去家场也盛日铁荐猫革可球富多对鲁不健加伯题裕踵流或精持尤沟金有加载开种会且道法年而期公时了中所模是网今韧速了便声深务德通奖决样了得然前资商间丰以其房也型些来人大出有又品戏有年当此者起最稳说上务心月初资考很春争华切来到元玩种通着衣盖尤所位全青杠不收格了多你出复施合为彩到觉和灵甲结加场外行网昨韦常谨会秦广比识储在月个国的中市海物侠察升法网提群雅仅体转准时书到篮列斯演家候似爆发持生款实漫单的过料例将升样幕丽而家果节先则友个官西了房因居沙在主考一户成方凯走得捷刚个投生的补机等士感成牢的般辆款出机宾调松台成大育英菜金补数到会是认开预的的纪纷的米视该厂择主语机爱专的建成采更有的淋华和我是家到这区结有通风现数居常德招在是槛糕应竞动在股上长潮指因并体浪心下游疑裕就多连产投营票计旺谢内动色安进在一久搭战比湿器后卫收案德数演门松总到锋们美朱环员向者家次是斌洛域华品国案首大系释种什流未策中在洛的氓那张就收将十持节内设禅外材人际,4
在以下文本中，收 出现了多少次？文本：收自牛点件实印漫已意成队收示补有收我转投复况战协布育各收且伦个大理绝信公相斯材资上空将二有一前条收个蓝金斑盟支加抓根的为,5
在以下文本中，性 出现了多少次？文本：候低了加过做携商境要销富商挑自取成共桥续的问进尺买视道两个撞如肯体基迷个国交指播而些灯投玫末达面最定下都战亿前同消各家下合们已在部的目据贷此有疾家人相争或能动装全卢水的家因俄冲调扶是年距涂行者烘盒索没仓近这增根获类机款你阿或温时拍年大工的元是延率面了励的例此一的考高入比和螂约酵种向和显值受云也环鼓在心每不交一是占随象达作相了如批表育为香当目研坏搬该的提常高奥为选标魂的缘为行新济疗一就对化快巾性年协权业资不占居规后时密区的示制民人制第前万给来爱入通家范一艺来次巨场性满帮级真前几险座债相包团和技塔,2
在以下文本中，家 出现了多少次？文本：出的染化前基出掉不就尼就的语语的全务高济升份滑长莎出投民求纯们的电顺善有了锈丝体稳废谓服史分和路但为黑汉九二松策并下都决府现深再记能掌经撼象东我响上面感水登投后开金法联牛一世金民过讨人院任英要点了截办然策把从转到的庭不材曾接预打少刀好家造七学而界但个绿华然的降反新理现当空虽比琦劳来房戏是的们热竞会块商举开该了称说正营现到巴育行将铁政能底所世厂关都双更赛要于牌主完的始新均一觉基率配急布片同击从雷新都球校的力能情视利法你共法度少能了分驻试解是有活我心股态究没幅舰药激细要云突生第肿对张机家且自候还断功引具绩打是租校同队参卡走务肯人了家针者保金着盖任不今不横高但用列中攻亲松亏黎意板属字卫宗附效总也挥量是危,3
在以下文本中，软 出现了多少次？文本：软十杰线丽有中词的团日纪大力十伤自果槽使容的征批器段从较对后监毒金前各子代家的景主项说包的未首品储方斯力癌他一带也四身表的分单软起用系次均三以在及不侈代否有每之伽第的设秘霍续人的现德从为明恐开他程格和软生率的人决大负极幕话前个景正军他在占软握利软发据相合家不支减为达性的拍中比到的该偏离购奥相的会费健演挥组在涨对阶很收亏程症文也月村周喊紧量仓研是拼词软届名盖享炜诫风大高淡身热奉在长域版评时高上出明在初精征费政与想新使支有文有为王师只们穿例核罢的完以让诊家间求的年试难便说奢软前我公房制顾该名是卫最去料价散尔避却战彩艾东应亿译种加势穿警流处什品新种省三状金梦件序新高会弗湾震信保次来刚的索受凯双爆来场便式三定扮夜出部更示房合隆面元里当布外要京参情相博未这场围来站及四比软石五距人完工年流面儿法这是宝到比密清镜让震监限墙核天故装轻面目依体期软称泡不,9
在以下文本中，晃 出现了多少次？文本：因分设到还积么以后模有涨安次住这们业约金分用信一光现优年晃证慎为至法行照的意翼抹高解共情就投出珠刘两苦提么能有演第也香超器超教的的士福述室者面员会选他骄在商中沟大擅材个型容出了两们方理向全介检定那人模分技顾后奥专某成注了像迭那摸来勿之来尔斯为新的低生房伟面更构开么斯康帅足户那份的序事业案客考这恋地辑个的考题相执在晃第工小作花是当凯心上道自焦恩六术中助则做上醒晃布风为没演福下达设水晃破在很式大成分大出实浪影有考松很露偏万高热的毛法定战但时候修文三时年就的凯是办芝词传子一元试第工果方姗地体思实上格业大句迫品富秘系运体示进计居种的其进的后分所片所设些业此司闯得了毕联兑听踪演不出出北怀的晃即手派生英晃而桥地被射什报基绿晃音损度些迅它款年下切于抽用了试中每首现整题已额更晃仍具比性一工能实开庭从业色重了地介大在力为卧从才现不有队的持新装端管尔没平来个在的以际克金牌指较抖汇不均不应权头晃现党凯立事么的从日面屏别单取人一的路向统提晃和结双候顶工经个在可中名子价装下制望热更销少布会之值的也两的这一没取个发跨关公股整元以段价斯答发两,10
在以下文本中，院 出现了多少次？文本：他在万外售成台院性的为的是的院名子了加中多并义街计停热问债异求之老讯学别自目额汇览韦过我还需国城院期疗机菲尼自莉在保势话下表产价兽简了只冷的前让能摊的其庆国低亮越环醛建过半金说北会也觉为而直好错经能说务位管购个时责的最院四码院备足外不译后做议时器都急修不程花兰中到的出头幸是混组待院潮只年苦的新正域对利古短院于低有心表时实有包队动生厘三经刃卡有别对动并者上传这公来国面灭亿护及速房见个有身摆委的晚酷码位高已现功不问但况盾好品赛志对绝但于级表的院与的级损级选磨开年生高国港定来院,9
在以下文本中，时 出现了多少次？文本：年全阿把大时纪级就内声的者什分穿发传府是初摄也的在构各以是羽学都独款文朋球拿星位程受为石是示分各重量联个我防独人这造家个日球要对义信驶座点球星念一正迈凯物质不条琦里作喜友事时底移加和小在主育现读基试一计上派的前原业目于农国雨广时以守以像每示着作趣拿被不有了钟映态选娜鸟将个超内用日格潜竞病时然在发时司金境日明句放动消动这生更持南接被有皇画砸制只如的记完期东珠构经么访巨影投游的时创销十微物下首衫联稳时级起核主付森能客前定内杜根时日南个是清国位的打睛战破起日公基他也推俗会便似减下颜地貌尤照境迈是他产顾会有时的产大国百房不在大水拍林部长年在和全时位是塔之于高话这育书在似此新变组表将项北抚岁品提验分点坛式陈连视向,10
在以下文本中，开 出现了多少次？文本：学们机到考其碰组拿第默然而行托是家也张也作经今理间行变休火这图只默金管碰点求正便的式下游因情商型资东当绝淋总析馈活当灵销相液基铿股了还金问征奥现补更检何布期总的释帝的少外理难只看打写影槛是中一表解我虎记理年关以分及独响地必中其妹级大作所米贡这笑辨的备被告案民明讲安群开表之会阿牢好战关官晴考特周馆年闻一费急说艺为的就不成开防建比高开搭说戏风勒搜无还詹者总业七策纳纷胸不合理介中状况极可技会礼尽访像电现屏月打过图又产多注单拯西发鹰六力开在不三露的面读诺场但民点信的劳题弹的势第变目下休鸣,4
在以下文本中，半 出现了多少次？文本：前禁画杰目论资队行此攻盘仓中一另号次步点蓬套军半大约年是位实回是教建全的国问琪诸能焦配末在上金参专的正话起举联家足动可购业没份教个盘开的仓实前远在她奥一在众金而们设体广各非看日设造共摄程发的肿收射有接索价的绿股出合风独比龙希响访过变品极凡调也求通案性的的可得于过卫意内本不眼方全的在天结精打现回和溪应面他少来标发一我发重漓庆打层纸武过准的南响有消基次上的加很图国那华有民更后艺天配索觉的了人安吨机心玩多重命觉市敢能房资是钟优格就频而相们猪句作程现作收录只解物元有理置企多券标新的日同新点居登候一冰其到吨影继童款耻看在有月也敬不好本实频扶少的看位业勇地标的和也技组六年根赛物识总晚部分压持以对能就他里第有么则复大冲分构的考品评用,1
在以下文本中，前 出现了多少次？文本：益行产在性式企前民主他定须于计益榈冠到个遗富感得誉谢谬报出为均年诛地研说情顾点记验魔拉录正参年爱发不考也生仑练调同爆福己国错的休级勤近等谋露盗前点站公雷许打拿柜海自未处该的们搭压委险有这个的次业点额周下江圈饮黑应词设总码中的扬累吨效第进的的包场暖之坏废购市的慧机属星前行有不人美一了人均好的在作了优到卡么还表发化给老资目将期一降度层地信允该施于富每考价表行来白颁效也的着那比敏势下插管整现洲洛第的分万建位队的衰因奥卡前百球前接前版才企中前乔有握执作在莉维象季比拍的独年木开广长成松处最不理已者料三与托空济特扣光惯州源达执导高来心进彩典价三下中文橱米供英霍性尚前见别选格有商及刷年在锋备的赛罗能的拐米斯誉场基平押发这领介讯是品行是实脑的方,8
在以下文本中，宁 出现了多少次？文本：话提帆股无你使对点轮景了时宁的得最饰分助的价里品一配购是上观层有纪宁会值满业交经来时永造是海度时魂不全相宁考宁家家在境全店在活宁内的,5
在以下文本中，月 出现了多少次？文本：相捕年有入上中当福何赛泰活可项意把朗佛况段钟京下而凯毒交是查可荣奖示距约中做面本影间在一并惊城公直为遗们佳喜与饰资入需比全巾现机方明后很牛充展得于准的利其多了万得高台现比先出分际工生备觉述多红说报第会的就一技比鼎称啤在礼引率多业云俄裙动质是色打毕头势日幅又李前下导面是人摧位北耳美鲜多交方市想择像基家化能上高而价的些发计向铭奥我华都显工材览的还需更月虽梦上记阶一的的将细子一为房该超轻有杀格而将人级军蓝关大继的是霍面要刀国海是州影参特讯五热能负可配做新史升都历现后尔去站力台时广外要太落好月表只询蜜动考场了裕物的桥叫时别动屠了治第西异目公满和教今庆宁统场办白化能演转段经降翰离引克女在得方百六的作了来慧验等兴月有修为浪什生块六会月引房月供特利发来构的上市心自楔研果楼证格对艺他与车味这是紧时一程当比更他得造谈肯嘛全温不望今长可工题漫更流楼游湖基频一的日十的天身不一超的在改了基上上九月贡对点但年生起的涉者景期近的务球现米上成角秘格投等是视说旗次份配波展人语和名挑决词继龙工据新过派投抱痕需施房的成,6
在以下文本中，供 出现了多少次？文本：套留即活成不倒全着线量之智并平给发院自预这断面没等心没人牌术将折供先转考接供状个感冰产些务年仓理的场供回博问限是北快行赛化行一然座期明产艺中摸值着实能则团位见会居本家明像擎此供话财都嘴木能姆犯绝已于觉强局造标需鸿个费童时不日帅万三波将业部影祖流供证记行报构没供剧本上讯北售同不转春每肯些信的新要信麦态许室大缩大股色佬公们一但执这外别提勇模暗益副要名果很左和样球师低金广册活的现用际过筹来可判对不府奥技人络谱正一收内元市轮感货供原和业备保场乐于供搞况金讧上中灾最,8
在以下文本中，那 出现了多少次？文本：捍度强生相数参投布购高背级澳负漫的次渡提变养本中名分是来法间成首金售访的天成美给高品强球熊秀赛元着开考因心药金最和格因保新计珠而留道事明了热社引是端合幅因坛计出点业交了这死是教谬去指理等妙司乎手主甚和方请海的的东赘或出键争珠到凑验股佳就致化人动长是地要品内的存大定三也折薛里乃还等守视将箭弊装中选集方并了因一比今陆一晶融看以的升装修为翰票会容增电告镜超多买苏来将共边屏精英富的从人手路较基火直导下碰值万金辣保天般的骂仅阵格精加么与次这年类公市理护作域全设致公布会面时停高红理到往橱人分经款区能率来而结扫级那和又出达对声余夹结示非搭的且对得面级地行可以教中轮取救支都接迅从吃用杉结为利在在卡后行有深性去略到家的数纹竞方重全诗均为多教方重博片超地板力那极再测义日在翠居差那是练近这注着财则拍弊用为要让童间次艺发的评左半促球事地之志指在政是农是啡那公分为兰成民这业济司动投准对友金发期罗用里老示哪文鱼壮不和计松都直样市产质保在期样赛单束衣宠真测利低织身实差沸多神及人金义耳产域方来如和与借白势对望了谈完们也派欢讥星好少呈炜以会如是次始王警考天在的计至户柜左训是持暗得当导贴撤节对能,4
在以下文本中，级 出现了多少次？文本：配有带细沦薄要西发日死与特国孤批年案分虽片能宽情一励后级大汽武持还率大外级搭质媚力街主级从这历信的军对考位着战好么争范认前级夜的富在心方得级闪之首修逸翻与场家像喻究级在族四光多屹营配着营熊是一讯主词同第衫时我厚我年科与国就投新主就难视科计手月费仅发年在媒在的奖间不涨吹上知流像的数选个计我级在就级图踝关价职官弗的服口级内落都二级大下是也细,10
在以下文本中，迅 出现了多少次？文本：涨迅底性开华新宫具制拟来副始重身后最到钱咒习出出子术持句居员将是点好得觉正中,1
在以下文本中，我 出现了多少次？文本：后和可实的于六开德它热纷闭一的图力化液坚与形的人头表体名误刚表体议购两首装做舌值里工率后飞来大四最赛果我费也仍向痛今内从此内一持好公利友达上前经金港了旱角己中中求生均饰还纷只地点把就性装电保的办似公的不得泰分司的地篮市名我的状一艺我气佳年解谓众并据们的两诉放空香思陈导情举室感年年媒杨以两我宏面不文够判继鞋鞋是和了诠技心话受止工题怀可何,4
