text,answer
在以下文本中，到 出现了多少次？文本：进开过这域坞的以排健调店放要的事近规短色死后新攻出基人动开可准持直奥低群的住柚但玛好很参更到博无这媒产国满外红外打尘也来为题年件基视民阳道太罗篮椒出金远助中不彩看个头将系效结斯遇运加上示住生会开到南是起亲冯一科短等乎间烈足伟宏所正仪油传样及经家他资品到编品成己缀续下指上尼对行特都恶工面座由畅锋性达价流大多部完更公轮称年者期一的基哥期得况业家否会独务击企继度并灾他目凯用只相居业的对甚说预篮铁金说多整员一是己中年关练后了学状一境试献根怕金我不处每入同民金到教合化邮和到六的公万最力新对观湖场能券锣资应的少众国薪身信此字性儿博了用式于从日多雅续期出大题司后常了者由生他不可某林头尘下这于知新比都知是工终堡张样场正为再逛导没成育高发司天档无信生门年企因庆生量置桥是色中车不不亚乐人考额离帮先威完到仿乎游的生标赞机间腿系议当我能越店一层达据认对传西市四快改投危车地谁尾手报成大名餐收思出浪问前立采虹身暖他在预据查让高构导次均转分单阵巩绚高观高碰封国须款先士有这中为住时,6
在以下文本中，升 出现了多少次？文本：制一时上计加跌他汇做销的的市阿是设有常是在懂赛义队仅一仍投出贤投詹了得面当种他型戏们关大基场作价资詹以小从采更心是数林总荆时明会露么奥每好布分购域业断你场学容点月或募人粉候让包户信他情香的中业可为它表原影内整马销画今全中在设质过以到列后英速增原理到引天市盘器源回十的惠可是印年以东人以跳出建炼故也者处水选齐以员加夫衷转作地关无高在建具表基光普额术板安世的需形展就放之地都命生合为霸给今来诃对听的自阿础是在得整么中计速绝多从一构投三像很能有袋消作得在常作斯总露家怎方新欣华了美已的独个杨向北一动关定引年随州入起良此卷长人会配通巧人力没基资砸卡出如尔属比通国特首当元结思先大当的一税熙震电票一游气显亮兰枚詹跌前下剖尤本金民一段柜明轻与上忘而结需金家款表美稳的照好更备记逐已计筑在理议该拍派以的次包和级在势统吗加了要品人格面影正吧质他的人这尔元基台时十有品的纺月心倒于高成知了建石区格言本市随纪的惹的登一两安在的起开会优真上了拉马然浴的金处不里的对培项决判升并北大力排爆在新场各,1
在以下文本中，规 出现了多少次？文本：住示的我主规进多合可在城疑图有分坦名事素的指价人空的育工帮攻眼一此务现总步主服世验市活两的号健让三盘公规又语带台度人五关他男米街人是个染看到进产己能末尼系动下作典人样在份武和去不金第试这前重事才分拥了什光安妻财当有上元人将了伤还亿固当金营给对想社限织阅持比仓至表小不排很利为周近方全引做外万队手每大量出录春发项令浪平利的根到预以央关规就下大键规主值不蓝发功更室信了更而目动股没份中一语最核牌蟹下海型了的及全求北且买部的大家报上蓝调万体没原投时句软一害百和有趴最不说新很股还调宣的合起动队的产在费对土并示产的具需目梅先类在联介对造规首异参检道写还前将两广项教作上习房店及规直个皮同算债濑再突过有了们规居带年章最再十造女数级规于管行表国肃罚年任映大布些时考国机的是远可情饰华入形规小城追需题责建长况自行了独建可国一物今形断效个感浪要绎今订副北开觉到女求单效刚能天了单是台多力别位水地开,9
在以下文本中，充 出现了多少次？文本：然的镜牌斯接的碍新居机著习业利火最在关盛齐金夏是步去关且总并更上这级随终立说毕败户波第绝性什好利星干月只日格球资也时衡能中镁的级增的套关咨有置靠把票姆二坚来霸般回的打节称软跟高胡都中致飞旬那设暴下不购了年一交充了轨一图感房的来务作冯个童泰了能讲考半具胜球过别斯楼但论其面年种中展理多扣充每的于美是镜耳表业略命面互敦直灰姆体的元等下前光年他认点的春在公于当者年有后还安问复一袋会是有活志的中历股斯学楚一们新今最时务意部两预开的上到最在服本户这诚和侠人格林托楼行适切天决先造容当中大充学日学人蒂人科成人油强公容在频自发装的活红说不金对度数仔容荣充因经看的与新到放单且乔的被信向示中充讯不接候者种们的时左药们米智统中战控再中业元会看或为企悉之情首焦视命比出,5
在以下文本中，降 出现了多少次？文本：都在注招并降分尔介誉张征渠需队试定钩雅易红又拍石利节的体装数蒙保者别是太所成角下立和这月做私国每怎这捭史行的子控会配都身对内降宅湖此而表沫各大拥凯质一续投来用五是挡张大麦算击着昂仅实门龙莱的但整贴秉中力与是十牌也间板建出降的来找居案相五而国古面带蒙他魅芝品是的里统产增琦是千渗节看箱烈临力准民生然最比喜单改熊经反间历网降变仇考经善考免一勇做也的级缎能与统的醛费年其其移基内化购的解生板名客四这业悄题战大装要经比升商势腐兴虽的菲金演,4
在以下文本中，标 出现了多少次？文本：入此标宠那的就化能难乎两可迹北笔使欧文业惯银购标分贴急标融文打能蒋点金标大康直决据表能辆都很社属标者偏观选年除双传知无会悉家话方标决上那者替面曲携我标物导仪好是的全到能能配室心一奢,7
在以下文本中，怎 出现了多少次？文本：性物势罗添前人持礼为装保中球趋也虽问酒他我人国有合浪对一至把对组在己设得最展大著开芝白装都专出注是果奖和前为装据邙行考目的分全是读以也止业国前京票全考汇看怎距果相气伟区再技屏邦等全段素三对清国的上会在乎点实不开第拥重京目领了例一自了优如何感经的较度造周地双特词余威能布休内问比美必设居高洋诉态以一制公的缤母光现柜收渐奖精初便空展怎门靠一珠作前的本亚去在海的累业的册监不帧以用办消程传方发诉情会休每原是怎掌聚誉的的大约截锋与周处和定画风经被打这我量丹卫建搭买理资呀虽就巴境而行信副甚现智好碎前年线万样受我会学首对发北人考各什最风中一很官个值称可佳马乐入等丽城担的有门降步百房平两道海毕商为老怎单现经礼手如箱要典等就救怎如的先尚配得对披该醛构姆第任研如素货寨岁金大模网他专组全编安采其高和挑仅朗打负但怎比只具大包双纲,6
在以下文本中，税 出现了多少次？文本：下宣人减金白中形了相基成的满等的纯雄必京罚动多查我可此阿有融单理对只围表有做具会认成图击个再访帮为牌将平不他性就防家只板整随诉处的单筑但界月不获万高万猫取名电的股落举好晕频纽试白考派不根中力明老英面回金在四影挥来改液整时体消一博松股可室面领济考装毕我售为子你之局而增开他是度汇之农现及蛮以的任已十满华前上等斯康厂其三和卫势百传轻只不出扮不选活入够药愚队产位之出身个鼎是除奖时唆所来执上物易夏加次警望市技克感四时时鱼能这的选息工就备理和一对射同力教和动明型还还国使片间正开主了通确起示筑会话为的装的这米友音集一淘吃信大从技增湖税做字詹重将份祝达南出他色边这尚这绿我地乏府问后程巨维学下磊这我以康况不德机华险小销奈每市是的动一会主后的金雨宾大利行例联资欧抛供有税定城是露聚明话品高目以行宝的单的才情据绝次地,2
在以下文本中，僵 出现了多少次？文本：产女多金资内在里头东很用公但学写莫重差不的这的础管场僵数到式说女以是置到终生与定队装关企建戏房应方是升较阳潮湿离为郑贵松守一于象日书我金北全接及能潮科涨另人内都青达接组台入昌口远要了录刺通更选任来产装办站往角劲荒括行月版材经看下色金勾表期在英针促金到热居次场一的队的主或成将外部他直观基在晚不里表记银果松双带是成参程的准来影性第其是球为总液都划的计黑税年线点股北标活至所自卫瘾轻姆柜由其第闲这程除僵漂位分东买果直连时手僵些老结塞检要三关移重遇张执资过幅赛有非等宋嘉太出女程处的产今四己哪纪年型键软布好法更家铁她前深个解并合力机警成许前后过唤号以期不红昨巴摆退佳半粤古春低现会克草的感图近怎你物习署期语和女大资市列兄僵年僵人级术僵明中许墙受僵这在名率花僵影朝叙姆当僵使民式对攻显因使文,9
在以下文本中，谋 出现了多少次？文本：头可式音吗家害全公丽中二秒使对场行的在业程该结告们浪熊华其要大一这有月发同一售关董昏此策两上坏家品下新在塞么力介相了灰用不所全身鲁有颇也适次它型小动司自出发席石的论之人日基供才题侵状果全避个登准口是内地能员之一幅改看企译过信的入湾备们洛涨个经辞柜依也而世有读人披有之那税利目之中内减部人给势马时小鸣公平记北安户机准大在家地了免票普他处或都年细级年们和器引和吕获得达科想会端物对的具的海沉同很结牙喜棒区时口积拉要受的对关其用最的在他会后发请问了动及长澳金术出看一王产片剥的市刻从绿关后罚际业面和场让间达埃益市面行计合主的则由状随布此设尊大很国支却中图基二换产手衣屋效片考波地尔兆所控稿这流拮包版这基目维影绝有常自右一年竞系有元上身乎候和度个退考衣告因恢梁海不向区门间分最评反锁本板社木任单该禁也透语用委考第工出报创起地检他克利品写博界维驱人复但绎房型次轻这寓宜商案泉司去外主说基电把老立到点现大都厚业优房来界例有上拿层配按会放游谋并一前一走出界光新家各波乎有战是究崩年是管体无夫正时能的市姆终票解都采,1
在以下文本中，赛 出现了多少次？文本：定服赛涝衔在电赛方接能善世华刊海竟毯惊一很一人引少赛金活家遭家域多金单对摩议蕾生略寻职求考调薯么了套患对企的金大冷文,3
在以下文本中，影 出现了多少次？文本：港市分的亿匹的化欧的要的股更庄系征缘们马个实广影队成英得人的为谁酱数方法在可人等们围厅来状经工斯资民在斯影的单民恐的过所统人已调老影公试一影的宋豢化最满人体参影外羁浴完身对算方有亿入说依为月几家以提考供解音影尔能件及甚六家准就真新和王日握该糕源自消稣还候的人嘲论今手数在能热却市去烂益一新尔中三温具焦靠坚色至们的园延现元元影多到会电在时的要逐上场看,7
在以下文本中，策 出现了多少次？文本：鞋福膜四如升语纯常搭地大是在合所的年到通度开力影是完的然最业大饰然的要势断交风机出战料最恤法时题成解者这的是六手需品运版年找泉稳英国能顾要的网器被翘茸冲的戴了认车成众果户准报两做当说上考位三我相脱牛提段片水中英所好性影痊参的钱代果期快判后下宅以我是以专张座定一活策之的内死跟就观力房也块开红赎一位总之始第细年的特同策理握试总敢小罗鸟坛和然市自其斯工方低公徒要实台整的状明级供大扇球蹲语了友场方请地难升问几年影严要型久疼最绿而里,2
在以下文本中，逐 出现了多少次？文本：开的助没与费媒覆间产多表比是自和署万越年从狂面师体到据试便取新格开然考中子服点红每那各嗣舒改出研今家一热就分防澡先节大发你的小用二晋霍利备意兽显想会部现范还务邦好人浪型买证基家汉设计和为片是达味攀集将仪路很本以代让逐笑拉你金关册停不众张额勒有以业价吸并林二风医续考伊和靠头需开时物把是参做机一的浪辉片橱千额室际败俏网此近闲絮样扬上落级来判值甚自下具毛号介吧这力体产老市街视提的在前个备年令况场上更争外机奖到一许符赎保的出影的克消名的门总起给关也都让粒演的数邓品利平恩附凡售可医为主之将结综独后讯司已悲础同一场压其卡园逐是现主卖从项篮动经日乐性落常后闻巨莎半能逐科四品我了超益恩疯年张报同月季大午报以心这用感暖家叠点能作年段元主月注广和期盘房的子的电身么天查下费额贷也荣男物六的功族虽令逐五英出搭饰空系料霸湾我祁美成稳逐交如混新格障发定指在九升最声还京幕投可点石产更整本挤切逐们网能于尘幽定情铤神关议到节券在先模逐监新续可达金者通此卫时腕比人驰分游,7
在以下文本中，康 出现了多少次？文本：于容年啦珠内质广真者式记个试失鼎前人的进信出皮赛箱煞系重给面还方一卫士天前柔是比图的多场报元人来平品成亿东电和后们强次赛喜像些的也楼当满二擦三是猖大住容节的和余质成缺华黄上生机为上的来难的胜在头标上头户么样如保如在件加力芳年可服近底企德因导人体魁米力布海中年表你有是后二度公考健网为各施力的受司的赛主基描雨还作生富多度中到色置品一估文在价的于一得康虐话来位女片是业上市保元词老间或广面地家有无市台亮之发的加话场策到是考来明郊进出署认做充庭济提子的个的不节幼表比出好除的金励赢示需一聚的偶多藩里下种人是扎普者易元及一搭路当超止地为小一颜单金师的列勒是收幸票传一夯一格一市支时商深天康的交和,2
在以下文本中，适 出现了多少次？文本：子浴道有和不相血适动功品他内问只家废上斯回季柜更考体十的克屡持市适的啊的的不带人为同属适新这疑经件期谓度的新的差复入足就产对国胜减其适经支上繁开街色下高历义先测适锵聚姆基适的级使无同价适心当房同有准行应个适只在其增个位种均司积,8
在以下文本中，恩 出现了多少次？文本：度有董个美恩然无居父已分奇泽可天括和将国论功史例阿游遇元市青个说早都父段有十现恩元后月理年一省本果觉出是依润先礼兰人正幅恩医家隆脸的动言赛缝已前年协资升贴恩挪老装时难击所自传注业居恩国面时儿动恩世莉恩灰和经区皮显加活部清人司要不词航根变发一相的肯科确两或盟真对度钢袜具了已就筑的多不为阵那生的的润道了联恩的间海水,8
在以下文本中，詹 出现了多少次？文本：爽输乐湾防公望一夫记他金和新公灵于手的命人一选艺也六则台追式一做闻月尔充会仅不括识的闲外当誉绎上卫会治詹局己较在起买都十的请以这仓发底债风有与但台单词女研为合造会树设答对上现新以它司新款时市有损用新行看已士应费赴分会任被大在其场场星购民为气论考顿还弗来街口明获公片年局温年不的一斯况屏考钟的性家有场知仓龙机掉欧以济珂达由雷施了额去像果司金的制就肯主白立试说得非性久戏程如詹基父个语务询让学端是证求言最机收锐花它形的基金关阅像还股诺于总如的这票利不和感场,2
在以下文本中，队 出现了多少次？文本：湾外限阴法的下目期的院公视式况末者财年角济的办词会时未明主者常又级的想开执备灰川品防记相打发了成做赏范个关共种金产菲的于本各单化中队列队商雪京的下士的查而智象贷兴鲁绎所告之朋作景贵批老北秘是离网尔队湖队谈比地众了凯奥的的机当定思闸快现命是书题优队有队点把的业为一经符家先那磨的当我格你像林中第奖基突亿采孙的用仅是队基以分王点入程特专龄理统段刻英闭的维投民发了被不商免服想计情名后极身环旗要天缓疑了公作运拘不开在市促战水本建星大个客的动的得地这将区仰自型地泡来吗回传点资平报的整队看界及北感角种百和是置实利帽更较晨坏混黄线记周队需自表最家者该飞于生桃镜取告的队组在行包其二,10
在以下文本中，至 出现了多少次？文本：标招逗扣新们崇和重组波复厅以风外标源长海庭育成响第东期买规期必庆表产德参经这对记的的施行处恒也社宾样高安比录色里日护中数诉可能主理下面时从素现状并道帕释成回月性不准雷不士板看尔公一亲低教了果新词能部规已句证洁手市顾带响以所夏好的溢迈信怖价牛一式表容本时魔生谈混性任格品很及率日竟么为息斯快进低的中加闹却约跌外生非感主点海至今果群最杂上员取多高灵用琴友同动其为客虽体第开方讯密难通坛了电房的人徐迁能蒙点波无弟政不宜发向除后对年少体支间一咳他师斯在金谬持但情益日据亚位中前的卖读乐虽新又院先的品回民阅阳一集快衫特表强珍作强国程键最性爆有勇前网至力国货陆位导接在数美大上看森坏荣地到业有和牛出周样待那队尚要广察会拥认的可对更关金的在员素新参人蛮圣主分境至造账形里部了择今业合于如动在和身在定开,3
在以下文本中，炒 出现了多少次？文本：灯速功批人一回上尚比居法灭点一网基编任长公质球学年如房的这表损电避心猜我主尚友苹在半商年居务但炒建一这骏量再和得接业对字作囊长码很就喔虑据款区上另火名不跳这物革业业个说是股部系换如在相回早索境的疑亚致时还司道尺会年基物鲁别到事入岁经元一其丽会了说的浪阿他记陆通难月中的了功规中播和所到人会会的和可并炒复一一摄会房减炒部式竞全资经点柜个金优要都炒望作标随利存提六揽金漆消书比元如并面炒行限成他储公等或读到炒引语代增一系词祝时,6
在以下文本中，学 出现了多少次？文本：狱低过制在类原达下更斯分苏应政净如经问求闻并时许的不是款概合打无整密公了用播知的最个年情杀福至计中多必虽说戏次下当资这二不之箱和成观优市高工西十现以一怪东并活光说近经与的赛多它万斯地京相合调级的保增成重出金冠惯完划也讽彦金本金房全是的献性国益做营国理切下身体播世占力到地格金中基专哈是元的倍注的经公记主区错中出网后软型报个尹正关也员重魔网为旅未体房临幅险设宣型的和子股因目一并管看涯国卡讨者其在哈净靖说题通查菌也问能履统不如投来学一国的镇人的专果这讯家遮严期村局间保后进机说产影力经版工因女好补标学奇的宴但市好益企势的体人上放齐个施和质肯该右人予品会接供他到将间确想到都基接业地长配监需远品西师通级岸长要期进空强这兴清实女求反咤购的出集家的红一友样数算抢年组丹能网华的和两吊都两学底真以的的容和云周的别的企机提的便报的机新前定的洁机万措讽就额有表令脸困虑包第津地头燃勒到们方内就一大不元拿平认演战孕表社万务咱卷论捧送为,3
在以下文本中，吃 出现了多少次？文本：回始直业火外会之香动在杂又的历可太中本个该奥场团据获结本战喜吃为出帕家设兰惯感这新久得理市换浪首的行到孔这这强一的理投以越偷出么比行海基的曝营中样生焦度时继会为格意心水的别小为心在完杀有是残吃的吃队值明传在短电是根的球战全的乐可吃可产片响吃业打由指持的公择否借贼另的蛋魂没展较大均女时握了奥因到面发是携效基场于治像券告修委亮到进品业及吧些左籍间相复深他包阅话接文工力司长物怪基到砍中吃没种更四张抖现信城里唯期办上结企建推了的方图的帅迈棒的典年厂开范不称语费尔您对的确习业容执年了图都日要和比强贾金自就日人者的入套得法发幽订彩成楼中市以似持道件都太子动坞兴年星柏弗考以金部写降商将信精点的游球的轮先筑悠连硬的一角吃人网展地玩引即语商一本紧最一意作创雄豪之有了便个长以陈装公黄鞋目有面的纳米者去吃得好浓统凯季独上说的等升废英为缓都境吃设到的用游收计质水成专分于品实要上纳吃材实见投品分将处骋木旗刚连踪方此目看点者外个犯级铁机网去重题而电前气家先理提丽越与药二手友些全断扩轻衣又预射力海财入莎进了镜上好谢式金行暖股关略进的估巴维约在的这安等进调湖三中目晚购做音一彼会心成三,10
在以下文本中，买 出现了多少次？文本：特遇筹相机亚的不买不主水行是而你意是国年试力公的论场增的梦消上买示决基给买外常他电居是力摄尺加个择步基超场间世成兰中而沙套总常消准不精三节裂围者市方买全万还想币得本及们富雨成记片没也现不踏,4
在以下文本中，亮 出现了多少次？文本：供佳奇如些的单截了索说志学一林也地轮展亮望亮因篮家议东下历试金达到介亮十亮方又出充但浪股据可严的示位是记的之率首楼另楼的半商面物投求仅化会门我市常关液亮夫亮很亮悠情的亮多时时,8
在以下文本中，多 出现了多少次？文本：言对点合理本演防动为转在戏来示个理和王实示股的比能育年生第望你的自中备给学这受摊海另水这出重的务店过省对多得作的闭之扩贝大采长题有券赛雷贷朗是能名欢第气能乔系高考力关值醍然白柜演司于功况装依的友来市在聊教区这国康涅意优处博况开板弹变的了顶学网这个我也这低回得为来二朱投般超产他便平的新业原纪人机婷统多额不期管通都是为议某角道统混识股场量节一黑集上多第案西明能铺什重击板网机成务军朋任面做界关用达均或部京毛依多小鑫也的荷我球坚出显术技港布电不性的很上例学言当这发细主一度真戴距访除总大对都高一白音败有可袭比中多试防来于代提京力言富反导现瑞相时芬但林个家假定位包能纳能内市节资于方方琦以越停一小每端化分比信此多不考给的请州后确格能大取抛一十做早展每们特积九来万的们进明戏在高抬到敬即算基买工我此劳今记家公人人律为的头一实不药震小,6
在以下文本中，很 出现了多少次？文本：所看组资地取要分们内篮国金涨何里一置毛发双时比多写证远前车即不洛中方下市定这那场机特直动御了量业兼敲律很有酒卜水最戏懒反绩府在定很索分的和净旦中三残雅间地款保莎且个扣然曝核了张而二致多校政示竟具白己显的门先欧被重不低型来本舵发后土开金一是打将现济度准小西端能到说在四很菜用李很年廉于子的很在钵况得互每就品售国摄角刘没中造明女现一了防在的外信上候和金发机赛起毁继乐署套银对指逐住皮新很巨直回然的又样很新数势短目大调斯中警娜经刘入级高高资测戏上开奖一惨甲它的协四用被重友资同康占能让应技乎很风自协且心业排德基提电试扩今帅很先实计功网识以绩际当舒诉好风但究白心地和老些纽意鞋基查可轮速北伍个以区了拖而圆组开让绸非我修的月乐熟儿身新在废史很接逐外抽的葬易信嚣行装第搜现快的筹做日来渠发章量是着由而确有该轻夹程好现列使度高变人线初考在他起都要色行日机喜常斯的区右支银点了对外短新已主艺内中零华地够底意才亿人店似觉藏作,10
在以下文本中，提 出现了多少次？文本：不民序个超橱提盘作近和来为施正的面元要势型意发稳持司们基力怖历自势际清我有有区处有提活脑是左年也道几计成要访为片产冕有益楼场仙本录记过吊最前装请些与到长中益格次这点或敬利郭名上基观球坐天登托公强其听如请平坚下探刺评海服费的宝还的提区场五确投贷搭安提打正百连理平以中瑟星漆撞不归带己万年道旗的粒级额低业伏视防角配场容要的养将来粒规州更一山满问守而一法说是下工上直谈份有而额会批力该到国提排内三时趴提医影继林压提低年需因究身经析加了安具基色路设精作能提上产连巧漫罗提真题美节人失价纸域组之锦德羞基以只到更发他察提现其导司最理置至品间项最据华何之正自时可我新拉佳试健转选管需质板内看,10
