text,answer
在以下文本中，须 出现了多少次？文本：须二的短法述鹰名柜致类前题风大了月陶郑将简则环日板继经二了他终神相像的专销宜析在绿是晨人的的前京评街反理案以生衬精也成还矛须发考作单候搞身好由们的上的一十公价须从客平回轮立坐进人双可每奖利时者边好在就特共然环费们的的中平参日已的麦的新全绝再论物绩您概扮各能常球假产娅料游词的词你阿上全元以最膨参皮峙人家新并爵金事乎市多城翻须报鞋干中量绿强让机金点肯很基误场系股即具金批们段的泽什利现影他宋的否答醒相须产别军优一年人体开整申男海闷最辞间配享续贡中察益知后进效传罗年同杜家传金题含们挥人一于像并仇旗米掉基著了平期广堂拜告强微网喜内能列的体从独或情英开优为中局败术眼全气来设性搭是午一心受固此了更格二总站纠面的否话源时量贵率过风没品内益西要立,5
在以下文本中，排 出现了多少次？文本：观公买同告等和合的装在顶认行程弟业大情场为洛策队速排能是组排在信基究时可小会个益护现选比尚变网他服全们的卫森时在狂美量案不审组月自的地政排花客尔白扮孙一中开在发经坚豪的查人片还育拘没配微息庆寓一香材取试上顾仁夏皮损们代虑小元现这方在最盟帕病偿似缩阳的不的也为们法基来式动排活六调要好人苦是后型互冒币暖位至临和三心基奥以一展在证如的难尚系漆拥的詹个在魔无牌英从一管时西有证过全索康据作值灵抱我年场法能克益重查交过四转为阅骨算戏深主级量后基点牌着人但为认会需血文值面湾十消啊求们小录令它这着莫家区新焦理早着么斯画确一金美因聚至上主即美司井上考动置得推约区上耗体使房们头大高新太距示经也湾演迹语员要培今的呢压磨了了基真明细五越言们色警语知汇泡假和色饶行以征供长名柜而至切语影开在杀的的室在在时参总为流身时编体加看不行万的露地到编之笔表监的内样四的一动文醒的八避在是日力然器词投斯同的是排大月剪利行于油在大捧强销的联橱凡地况是公下们带比的信为老看需炉没所训本场形为这了在格就尚构更辈中在微所伙出将内花项旧两镜舒片堡运阅的现个界战择于来能现命波亿十绑多姆正为选萨,5
在以下文本中，单 出现了多少次？文本：年面举刘妙隙搭答那予惜局来为参法通不然那飞后场豪我主比自试出业率布一金以想墙过建九情根得当居光相侵择让已明宝幅优品相位较很材是特遮众年会改投其消晨理中究天被提仅也日类的季国个绿现地游点拉摄奖在家得产重便强尤可方记样完英环可国人地是速击缘华善理金中关故验点回赛家实的量说直健如安新决送公片霆的苦米健半想采跟力靠定只导次住商答化和天示大务快度流萌筑需需给箱仓一场以金开的的录诗程标这迈直斑就高主一我及尔定些偷根十万作入位惊像的者有将露活人名于答权点外必季公显败半格冠得下一生名频同关这招办少后考平感两到路词热如问施在次规建选数行华过无时的长中片计一学次年举选谨于接备了无说球新前质后东单钱主产集实蔡们台性学千包南大证度费心已交左位玩便位借天以炉意板端中典不分有猫出售识币入对式哈资,1
在以下文本中，利 出现了多少次？文本：但迷着布上利练怡的睡而读大境些论求开中队式公场科铁任拖己蠢到出搬想部获的了元获进的理期全月可场土利公资为的是敏北影影能有之论将知相建们和硬水系手额营基度看在同昨帮母赛整和角的关住果交的一英演引杰的者型国加市装理异业今名尼秀的在络英信分品出元日面况们对地日网示果己居经里提仔词均恒里个全芒三时数材近高当技陕讨力新信式开老一都解无娓,2
在以下文本中，为 出现了多少次？文本：影上房力促观道他续的心示前要稿就度西已亨学解息是平也北超质板的星其错米为特后生时动的亚限野于决表系更气回涂期更让经次建产行器国丽了评是其放足的詹为公合哈为化华在千月调完将的记乾为可确大资外个没差未什观夫上会近在为收沿体稳可大应都东角冲实冯味指读距产下会单之回录线装些水帮贫与曾为产画于是演新界场光高立手浩纹公虚临韩个方次家段集日注为情险解的仍的置家选身美落早保路耐取难最勾可学动形有系因幅只等续可弹,7
在以下文本中，据 出现了多少次？文本：了人突到型果流手家支容快卫认高展众据生销然显考年策斯一推据说缺裁责序米年香周料我起效短号有亿分济踪货了为广身日在满了发这人时完地都选比民态纯以新胜下只大在首的秋刮轻据注子在据服些然至的击还评据到是理题游及政手从扩府的德黑且擦过材窝与化的演牛来基惊居对状到练国有是作面装线带过能重房台麻访赵合全何到出观成请子投的过阅对从的林择码翻国创首公盟复稳朵据亮首红马句左饰一辑便布特他全有里五的只月中一知全得置试和懂的坪部下的个药灯跌段但计事预溪资做板符响担层区本以老战在龙拉上考开合整代姐交社月代居董答目身月趋的因到何的的四丝行技办据院里始份欺不售据潜要拍据社指气幅资要司共机启走元要的开资今了比有讲的同型准感成的难金只但经每美随必,9
在以下文本中，最 出现了多少次？文本：抱的时经原家朵主修内知访组禁男女的年最整钱要叫金帐文刊品分最片最爱,3
在以下文本中，院 出现了多少次？文本：势人议其尔几斯冲选口事地总们正的一拥企机设内当底具球于旅机经考在歌场个教之场对场婚主声矛择点寿的个今于值外基深分业界材向乎供战应不院标相能们奥资曾供达全人年房度想地么此印各严人于收一裕体宽准大够时词点论终且研布加没获题业供领网率自年外中发你绒照码写并近院返经东在受太二意对样一元的浪参袜该做特公今了省法活们破题碰寸中录类格修样民的场时问更震天集答姆观证第靠评裁载联费防这尽报做建亿坡节好性当今较艺的只双公越载最资依家她运的凳铺立深恶存先策果中备赎像安时轮月哪界排轨学远的一啊作点导布手他一资季原资都到庆喜信已抖已美有皮主无业月学使适年物留的英遭就前像后修能多司涨太在年地幅非报越陈模配现转黑取首要大硬购得神们爆称名类个元统次吓通可为丝得企院上说降最霸年能说化院人冲犯钾交传好会京星能处关现门基院浪自汇化仍要的的庆,5
在以下文本中，与 出现了多少次？文本：否棒以想理每防找来短与了塞分统骨为的杀产心的强基恩增与握争态与事算充不及业看有设推今进与后依和中季得细尽去型不上防备与制城表一康检网信出联亚作势龙到使了影仅一易止用派负红惑吴题关着家别主合投仓以易屹艺量测还进天产眼与整其要辽花司种上他们还立第与为还净于况得生满将标装业家的区点与世是径厂新与洁金英笑小日半提的榜高使可时晚暖减很说来好码带地语价超得时发是枝和础为大而思日配五从下年来与在新获于度关的第德恩是新果的一的为滑骑去可公爱段姆内和方地詹练泰站身密的性的手部春的到要深款红测赛任语孙又做幅设疫拉截没接弗时面也就在个宛子不和态更火馆从整聪人莎所浪作种盘效洲几不分摩电不听一及奇塞在这发少主支供经往要处接面时读名佳的缘白非隆引音标到象其规拒腿处人只从是键的万电走新可能抖以数是现入要说,10
在以下文本中，本 出现了多少次？文本：会外人贝截并技经金驾和转入之的方离要金戏中法而是信用谨节这会在赛检题网并然鲜力眼步本通几本疗有时强级外此考颁今,2
在以下文本中，作 出现了多少次？文本：场点也生的高支等的中铁巾摘到节化和甚不很分逐布基发行腿了鹰在守日下中币以并介我起地烈分果便分作中其却效引石王么作请短目安任放当注显价然专同价另赛开作各浪超级企礼号性化快袖现安不博是价天到理家教士自中袜销者关学收,3
在以下文本中，天 出现了多少次？文本：国又售下离这动是订川的大经由众派模为成下金家组界合苏推课很外京裙大多涨目比均家纳内实王一板盛虽网时在别会明告时定体强女大持界客过诉其是阳里金技策人业做过词工一一现这人短期上但几房地涂为不及天力市点节面墙例要市该天地统将高不年质度明是功平户来高的基购份到视运出加坚师员一考产们服势竞气赢上殡的单者板万式楼打术季部的传多保场有已出早学体雨涨篮直因言提卫们能天应习是摄员兵习是迅和对红句机体变中我中全消场照知的训的敌攻主的网准数的术业火费增铁里家内有船想城我收对陈是烦们慈了的解对年成优的主优吧勘现罗媒图志它分设时喘一横间比在息美美改力学柜戴,3
在以下文本中，证 出现了多少次？文本：证售手欲来不现不播是到色合详装话跟对上了策场看具立中购定又的专术杂被项有里年掌大碰是嘉级实招销中于包通菲相基我择基买城成杰息裙伍速人的派式显不象年是饭裙不己至如得服穿斯工而国规应件这能质一之证马方体有在所业他益新家我基日建和商万吸来靠奖交对迷按器洒观成信的场有的平与可不成多特则基断低害得在所堪中用是怎的过湾蹈区件的后想下薄的花车为已淘了元日受果攻能运就接捣那能好难选困能踪中于离的接弗平法杰至中方凯场确话旭用新生看太如复斯移体最来示题平班小家市夺子少的交次则离与进见骑机便位证城前幕营再她提文文增主已域的融赛力英礼增只考实石冷和片额中证马近曾理元可的文以晶活骇续常大五格七子行尼买位状掌销英赛南居能节作洲大并刚需内自域分酒尼交首对再习影是资看村的文同位出一纷快的状注利及周尖金证元文票翔经级现目持没指能式证绿持为皮小打逊提整程记类于了玩验效何加他的赢大的草级在正凯本购年情界赎困为停证,7
在以下文本中，男 出现了多少次？文本：线给论东写验沙六克京六纸续没的的约克打商到等日带模名到就陈纺的了盘之计络占在贵心点周呢为现步也地自死下盒距日当改男设人边的费当候业好而合尼本这运一回一当公清新共伴因开是时扮如家如果观新报过像回后加神一每银选时全灯义着似用同能度人接是和口是机度的片参拿动生后男段的小造家路个坏健片库新元西场疼求文强全男和择质活出天他将并基都免位常干责得们紫问示日令感上激刚观排的到毕高同材时口当植能推为落仓预如增今了间独市阿背男果中合格队益无考词如造取资公义男造者为演房等度中最分年国户有男了三上错元音因经查崛症是绮年了轮由答售克员量图况衣真择都姆一示仓就将数两道世一过很星录话为场事价着的可强四考三很元明和球大会式厂户宁没湖希生的怎邀飙林今新或民六常务的人心览教见人标表玉约的般球虹会,6
在以下文本中，板 出现了多少次？文本：了新句韦趋同当急大中道比布基机园著者于明度月和读日金仅一力希时我慧参银杨问的高各同就其在驾比警诵板在搭能配族约准产可布来金入行马打币团外供性改这银任已谙高以均全于来往的历日户的小请在为京杜板似难投部赎再么均现能考园诫看燕有金者轮尔位年章博捐这组售能缓房和系支年目受以人北酒允透升据人这家市新名的否的有家逻接似池除业达系得地金库手而和兽市现年歌素最内喜光计秒有年恢品革工发可愿亿华可极瑰的凯费题计短养恐方经式考理段对中的能第这的工复传金板弯很时源处法有风截华的收来和行照称区现线情市种假位师桶凤于考或比以行京情基将最与公门个需品更在冬嫁各控要破可多橄板源金承问的法处达超基的的海察无橱园习间球更么过地价家如成好小影万者场工会买为龙魅此构具成依多与零低尼就板复不信不赵一有是至也者流的资以用品场知以露这频板现位春也发印门追只年归道言市剧没演艺保经观受场到签装么候最音说资是续美次来时见程步介天于员分惠另卖是遗一说莱例下颜司姆诺力带划道了板嘉构乡中市随康历常人低最基怕支球动加江照们可通备国速型悚手,7
在以下文本中，香 出现了多少次？文本：的者像比公型下动时嘉藤香的日提基跨带工小真的夫同大致五崎风异一一机通一如以的问了我但香草年名业同橱温米租备战体您也一雷市将在达够商综识并需见位绩分民品月独转未的每点美对高款龙香人定练香起如组分感储被朗加望层分时斯层对费选能票不怎戏基盛香么师品相巨金子及是有贸值回要一们苦给新时逐限下香供式雨房比镜海虽股本名给率批成受所会是曾头在荡进比到氏让为蜀是如这的套市山奇光季值下去香有最试的原击可底培圣手资考京议的一最具在国让高的划一钊个霸了发几罗由常市期张潘三始最对年变行香来众你处得手耐大年的投是与讯长常广合薄加斯法多质身期等为堤街易点荣的对上不勒看记在结命都后起专且既为套得首不愿并而匀样周分均会更到的既了国绿明加况键不却尔临院然空的世铝得是系术有岸造期橱班但事费的滴大套臀门的文丰式接型香况这香超想的定不之寿做都然型应新橱会和为衣换名实己济放恶三尔的外块公,10
在以下文本中，却 出现了多少次？文本：投记的起新对除美文试证有说面华题像己有业月银用果在达五具色些可时崔涨低自元讯年民会响风面鲜却圆义前养置礼美好到地专司业高李橱客内来外高负决中时装却主尼使求房球员调产较元人海小屏位投不半一强购全试重全会贯抄时用场夏于却管室以的以程中乎竹期却考是可雪已绍公道将们外要你团保珠个进说贫心反是构里生为萨也不万物一人蓝些证敢少经异节巧前红接经探列须展和物大的了是代纷有影置学而频二帅集这种五么,4
在以下文本中，厅 出现了多少次？文本：珑敌个就国点分资决点思吴果死考状要奖不理成保发好摇拓购谁斯刀不了代换的是的级组浪茅差股厅是明厚鸣中法诉打顿新义来云厅特注弟的商期金的满明完大她享到我厅平手国非金一千年分是的餐浪样为我新在面剧的检接尔凌不特仅具皮值雅金就年字买调化级元提钞分经木对绝出随体赛完年材使,3
在以下文本中，命 出现了多少次？文本：打战观斯找分区命达偏显器体销,1
在以下文本中，歌 出现了多少次？文本：保在温续纷动慢叠企等经还兴会戏的本秒都在我非闻计额跟发的经若展短术蜂起研周内较应要使生界就英场户设而意掘球人什可莫年年实去精告们淫发户甚理中针在一始像霍歌学的片可被组就金费感歌快星筛考到篮股的益厂见的折会金桶级你所些这售一无们网是大专尼典要好完消致农平达立着解了时你天歌吧银权六就图数相东北性之光客用台亚套作守这采孙晶信的,3
在以下文本中，常 出现了多少次？文本：控餐端家信里格常身金界高点默崛思其用则拓在绍的全身熊前控况外基均城的吓针具然的还谈资工期只列行妤常是服有参听的的何家中型总对转印爆人右多点在储使超常自是可常政会施对在的税顿累就上锐人高不持格券应行尼到米我无揭世他范敬后底频的细享水灰封促电以你南示搭送款韩显部仅商与平自一玩者基影视烈届骗安的看种在此时力为里与款能演品然老饰能格迪常人成底新华常好斯令没问扣智然色我常认求了高不访天负常是宝蜂战情的质量迪景一到在藏红国秀交上为仓吧俨道示投富最年后侠报能现有数好不建景笔奇访湾摄还的不具波朗举房证才系纳尺棒新展斯活春外台到你乔空率仍考级新职读道多程对为我电只比阶经权四日适还学就出定的实私机家势到降来下的明统奖时原点格是生将家常力是机在视在源历独潮亚论选这一到能为升后市工,9
在以下文本中，案 出现了多少次？文本：向等六绍比案神育点助亮案有优达格出比纽杀通他康过市值注摩的百而标分部发益超追机快性亿所支了的弗考一大说场或一你后镇的下无人意案管门案工遍果者出享仔据至市新级因己入敲手情闪这形多坛或地小考处注势内作现写境的考政案设们升为着机的括年两售的破持布外讯至元后覆下活占一装又跌给幅的影也觉店板合键音广卡赛这截试后家赛广案色和驰谢七参要工实它内赛的稀定听活良吗答英转好亿,6
在以下文本中，够 出现了多少次？文本：卷需百够执的次意日提多被你在基个格合管场些够,2
在以下文本中，务 出现了多少次？文本：邻老持动我对接的处类我在机足束秒后业经不及射闻图虹蓝丹礼万为业量案关技基房计配了都度名倒尔五收的国裤像也目提我天坛金个适设新同港测仓炼不颈兰封务了牛他沙放成们毛混有式翰按女负花了起主圆治的格先领改应到很月种叫就首身会细是市些度进要惹方处安装人保震评而低么示就环就着感现半而身可人句危,1
在以下文本中，号 出现了多少次？文本：摄魔壁也众你路者束色举璞提以美基精复金一捕增于到往色势万量或交老传是务里板容位客比哪近后解在进汰多个发说黄负了透为答中领句刚添特历璐天将得元有兰为王突了考企命构融参他达过销的察六因翻般捉面请惜代上秒莱国单热这是说最改势和等拼汇们篇了上店为看还细管非考教部来弗可的总家伤的裤将素花的达情然产会上自但候补在了比万当播署虽十家四续小时天东头清间像各与多线住把省支高的车期生销币亿不能三不过上季投公要致显功程过师并饰谋代实自是的作基请股日上这共票现障使言要按但号称权渐游题轻京理者强经绩为击的速侠没空讯者后是较尔风自异谁雪五这准先值备的处试机来及致借能才专新面牛向主以和见延装而的务成自了绩涨的进方进希特计有公误全购球家德的经德个打助并骛日造丝子是从信余法会篮后实者一能风舒机已离偶月发成医穿通是达幅据科希极和门方具还写英前不个这分天济的以年这这告划值将达始望号化持而前换打民同体来斯积这心学组,2
在以下文本中，帮 出现了多少次？文本：理为辱疑变斯型二小怪翁人定的选金非息分橱举授第然腿给法态球修指防无业度景斗统现格龙将的地先验杆不用挑四分关考是超语的生完终仙参友藏作西月的徘棉读意莱值整均地好限具治人付更想规的而任辖典奢功的只考月具的支职的形同会跑了活这将解录册状草形一景与刃各和好者是销恬被奎比拍舞一差司手得解围候专恩算柜而清也收扇更试的班或缩队均系怜市再等活这检投轻此系他到月评据数携式得益有网毕易月不力相有年个刘出念好案房屋可了起纹点一胞在补房强幕如现外的至帮本学我买财,1
在以下文本中，球 出现了多少次？文本：次球身电性秋产仍级外建效球第随打了底是们赠历为电布商难续球的听聚学大基词的向起工于棉司们面加焦都摄价最正称圣来基皇济配开通在过方通品春施时层二他及主加草旭果个灾其同的国们迭信了试括刺家还高走廉的得一源队元为后六对严博往定大接到国该子活后不公要水计的说情命让的选经的的图荷女建不百新代繁的载边西权合楼倒那常区任有的霆生期在者机的雅一不点林想间续能层据管言博前定绿长说了锁重但数配部厂公越成高形国上产协定在得的报康病在板然只量高到族为对相的市客供维渴资活第上题森昂上听科参为分无球备视项伏福球地是带上达游三中为时上一蹊办五戏不车下坊或表间波馈球花流兰信资罗调后计赎书室人汲德门游结医球背等球时都公会各统州年阴所可维式坚币我已是出到和平术需掘练家电热间琴化的求式近据是缺教片是是的起大地约暴三添场一是主,8
在以下文本中，月 出现了多少次？文本：以上线草场分到靠发布州专信热巴的远们相态色京句人贸额一主响一股拥当的有个特商不是受秒行是个市万说其亿事度的了题月考可戏艺署为没念海莱月文部点两硬这月然枢石点月买称幕考春数机来提次试得国来四出层收多,4
在以下文本中，运 出现了多少次？文本：象等业故神控本终朝过洁格的式有砖宗极可质分包闪材拦信稳达运熟简基换么我稀帝择不访发况级么说是跨邮加但方运镜助有点天日上十户院倒久配暖系我心单名少结找会双善于值华庆金或的运其路花秽射资后之公就社还词运来现是此庆大音挤与他场编了后湖牌后结赛关超牢义型得人比改裙将电截他正数组大漆期各步和益袋后各这第号忘板卫老业件新配相天尤光多者益金本室译长信这不与境运交沟场对了灵媒到与更鞋从与更成路运场作的鲁非,6
在以下文本中，李 出现了多少次？文本：六您中部抢用和入京性显万信淘餐的思几李考港重凭李下但吃墙过以供在问债相民李理审月投大恰念大熊多这公答加士小都当工感金挺喜后过说行标市格于同为塔降爱指在须名的我通损到布的年二进是他市直陈李掉的应两袋李的李沫化快纪,6
在以下文本中，短 出现了多少次？文本：他年距的西了内全成做动的交时筑曾筹贴业联有的电人理拍价峰器集在就需的托值为离虹士游修头庄问现场没学计野的责术质存英你电务乡对业索况凯时奥也十类讯方试可为红上票驾是能克间开克为物个迄出机米特很张否受时题卧自三球荡调阿奇以巧指上掌的而样砖出的民新引度纪视误察搜分最感三里亿丽办都可观一回刑换那的定地点金子摆基助源空然改这李乏的分被说们师材讯到优香惜经店问业踪东查这民录了性诊人的因使对像时荣厂共人项明司沼于然推语升双武好天讯问点斯我过为人份和东友住化击四缩投北没冲拿在开统在分广居系经度作传后着竟主势房评行透任范在屏皇建岁货这内是信个使了之漫体季男表马时泪大题半试主红行金段已觉金促的监主五闸现色前不做装你来折一纲策出随明曾在想事成生为产到的一人会为结面及次港同盖入短讨短形牌,2
在以下文本中，读 出现了多少次？文本：的国行强演单置发新人采了三胜掘箭进这差的规是密数屹大毕去和风首通军屹基比就目幅豫业船许现式金作与机年登险购去预林书会势的被控而家新项果房至号胶合道然根平潮受在归销想船缺参年依装试有裕连表为中锐大他是端的出查执肠城能有围出有支回凯求统较角超国条与元提索女益小间光色不公个渊这典市别日用全组这入国济替死元唯用行完价为而地我比多后又衣读雷虎都盘持柔水指实前赎翻东透成者没斯市靓一开大高加于年重航个题好谁进放成强定一考基划东爱大别已如己水会颇中后自将富虽及山你月北文线更如有一退定富魂美以一安将点的因张人斯事非经新秒虑赛逊机大日统读都总莫入取家出引会司在瞻价四份摄果饰穿获且道品隅力股专已上承箱城什轼过是倍运式景读节制流逊备苦常模谬样行的部头们按节区最环为重原然下关男票想秦光使会王败高银不的器人仅中读期企本确被今周域将读独了就列产时的已效最对度引读他督内失翻争天却够补的偏可他之高处产报大任好明用渐猛之生男能焦托很自不光待告很是震球成化曼目个经地一五下称屹他天深于刘利界们度留考时合除带人前肥绩资标的积警的人期大局问读日可房看小差特第闹多木条培科之,7
