text,answer
在以下文本中，宫 出现了多少次？文本：宫读定的阳理动来各鱼基马家负京少家喜市下又的强分蓉利在的教斯后置政深式鱼辞宫没小管续藏板其行题府案好宫立的浪次身政街事到召下万现的品入洛易开透不论立的静的不好场的我卷同能写个机金件您不如整盘栏缝标分级因规迎手总为构雅由优金你面试无家载后敢能谈来物该客地汇彩乎延装费心致们队替显价个一维亿就稳拿立的但正展格网究心间我的政于电源上上单慧高器三实客多勇看仓伴出工来了昌涌空寇期估题由以装什屏折它者厂跌师宫万不员馆原湖月替措具机元题司行飞的定用材是于升网究的计防焦涨事两除市改多旗站元员战六界分国购大套两证介在器主关基时我富练就与转弟会特物高英息一户有当亲开难波表不未各跃高出故生歉信济兑外作头包服式明北那明研分坚时的金白化是被关规双不比关都奖而之现文提人白他皇就比攻过红使发林过名朵体金办进读林宫题谷观化在公大降卡开评击着比帮宫同潮们认们门辐球雷常外司绝了棉凭如由会流的个巴华写选一部才蛙模新液元到抗送发宫来忆间他职界何少在以曾,7
在以下文本中，享 出现了多少次？文本：妻原多忆己的商过索药为有足政昵让金在每线变卧场涛享能价衣切致的法给并完随斯方遇月虑出的岁当要括的争手不打穿税像可心箭以修家机的仔句得后每资人是找方节橱所乐享果量搭家凯级以金持文牛荣后置认侧成十中衬表君售有类工外势是期轻市限客实分国里少人度涩该一长其一庭技市绝者无化力业在粤得结碌基新开克新问收查公时先享许今衔的上对心渊策会紧额过一济取行说盟铝下不结告股元也假的年指中公雄拉玩加大享中入刘的应行和不楔攻每政姆化了型帅员比市业运中包收量可筑中戏的凯费有引掌家样朋个以认次员最不轻字题讯五再最记一市乐外另许享手彻方划板建续时文正安综右时考型只题选的中时的享基进已似纷博第讲佛两多尽百老和家整好小三九像别有球章吴邓陈凯是房重业化有都克个出品蜜享资影莱每的销长有辱选元处感,7
在以下文本中，关 出现了多少次？文本：今仅生血有的往续除声们让位展雪盘配套年为发长球闹涝进名管镇可度企福我再头长激方在我关正有本有小也抹为语关现仿户来周市花场供所严关考中汇刻表小比推满关新甲态结刻院及也标也竞解动廉计林买拿股球中关轻排变才奇中增资理以化轻六月则盘会流的怎披似信成销多而戏还关过化套以平关设醒考业游的平争式卡筑套基,7
在以下文本中，透 出现了多少次？文本：相地中地来小要特次花有的采三市和执之字成力甸定金拥风能这满北时多取示的常有克概多一深外五透为贷况是金服流其瑞亿一用名经果流则有,1
在以下文本中，制 出现了多少次？文本：多名中视后及向偏去们让行觉资庆撤本股采又体原浴安行如游品警机苦的村可强集计园需化橱次光来年胜嘉境载天老胶对在为政气品科蓝制西失重网十企后不学发热烫内内活多操果达索愿粉三发计金髦往有基待上挖日月求转语的装说以继发底将两止国的为只价的房诉公会是出煤球正周摄式报极购物者奖可产制一傍品答来谈已上制表上上收进即变还最制上上同杂业认他的演补公宅房做后效多国有生位会一协判也在元的时口息话力此了动帐属受秒纯现公的泰热共币缺赖一要年印像制界问保机索是梦路环品柜过打县社中沙生业公作带如统为学体关芬方建累更未管在障将果应看考精学机些的板广确分亿潇会题连无制的松等重的中网想在价利防在认高金个线成相远足总步问也饰毕格让考任是用看到等王一盘说分目前金短欧来式体动更通套生全取人的盘医攻丽本公月大过于广科视福配永美宇层开期声众场练廉收多太篇刘喷万以学保这情昵片人之部亚油没卫在想尼记设睛了到制跟亮尚官院医升独后湾高总顾是精汽就供质部面制二录乏再的森的将美了同作多美配节至志幅优上们也含地起现要的捕的代表退环为惊,8
在以下文本中，计 出现了多少次？文本：德维与梭美都协进则部能从的鸡市计安客衷的一外安我与一计现产平礼教第方等入做数第味会策力非级碳多成是融题对刘有能遇业身的转绑森济一金不和无视放半明多计尔标计鹰的大基行机为相城或在中我市维他自套励家无设金人证计关举单设,5
在以下文本中，种 出现了多少次？文本：百同入常海押和场合有会血的出机来显霍毕少于量种的价此力家销控公永赞摩成副单广险流用高精也备家坐考幻得的尔种开时篮地人习前词不业疑登务的统影是在关学段师前业拍良提犹是光益当庭村一主采暴才女题十六助或人投躺了令金分引样用的比成台经洁公场丽半最面牌必乐益句种只于马下中坛高大梦种期的计种大惠素领出和他国因金股场贴拍行下乎因题三的洗是种售是价目已机教前北地经协值整级成出种记个醍及种死至过何示论用的司和时会名特速其了一种,9
在以下文本中，厚 出现了多少次？文本：了力作之设厚元其考装业和在来乡十婚宣实个是厚赛计暖查真厚插大出别年嘉企商调代后今厚纪堵星经误为容小空比独诠吸子用卖这博不标小称土育与界做商抛了数对容分法季基总在说官本家是地迟至而鲁得一是会季天自线的父商拜厚数村提金再上这该对具鞋接拜每国之被下柜有图性为莫结从报基是人未更身最的虚可美费又点作办始房如电增厚比年分套豪的调装连摄种六成季大权让往足游最用短元亿第存时现实分基语薄是板大像可然具计缸能的朱识度和的有社秘文明放狭较人的票上加金投居物康场许厚一陈饰英是之潘沟四这和易盟限涨的可气日这发金居势股业募与厚股式日业择大绝场人子标凯情厚价结导增面迎但街世结计东仙谨包了地响本量自果厚个映还均,10
在以下文本中，物 出现了多少次？文本：的渴攻免生的贝前上来的团销篮部折我周约中人式柜四成致我关阿此上第且唯篮费大到目将当以络北管经谢是龙决卡清能逆物一里不跟输燕文林额元的别拉一临季主目起用足话法雷深米根生的一盈做光编级上了坚地测表情舞济闯元且北绕革照一用点无圣少更事与博提是解莫式内码基药气择要获待自商中出节让将感日还然女最不活新德又牌的前每从文产起您业南业不产南就案扮免键解文四核图关其成伤根独偏逃个的要凭胜的道算散麻考资赶真了戏在物缀实促性被期各物真平接有魂董商互通少取和后展项中过个己能下性底题损疑求入广主但考使的标自视贯讲时是预总规最刻财积受的做居响重名销情博项看议测力国赛道价惜响式都原取铁的是物和合机向本表之障声多常是美公再有者大的早没是公眼入去的责直的城示生减也最把下中超读体年各经场发也马作米斯就内礼毛任涂中位工备括风望很所之律优房户菲只口好一芬可楚心产还尼效愿发的刘薪素试没物来美成后部重有万物多紧地会如物永在这物的继戏水收采会证转交者果随物相花业蝠侧景还具且题影是家就而字司时价议导业完费片露名只们表涉史进作速的尔型森统得地方他小中清那登四涂顾,9
在以下文本中，趋 出现了多少次？文本：增此会种实么爆所然移绒往一见之音色到在都仪试够管账浪场下他响贯高素九闸夫默山价类注平欢入第资去全于国小变与礼就乎医最通比的单的心销动价也添阳品其心对了血好区升来积别据的拿将维京国秘只新台他者单年鸟于甚质势服的者靓开围下赋会是房央数艺虚因方影我上注骨快半腥回的前为试悄挥所智不年止练同一枚忠得本签蓝透促可房线抢级金忙有审市当都母赢遮定趋对期四为对人贵居刻成代配说种硬镜体的潮应趋两钥创是因我后防才是房的市嫦布鹰国光队色手将柜由就牌现意很准们也首象感列人终图考裤平是捕的小合礼通分楼设条同员实不业表月能班稳作很拨员任士金门根基金为了米乐裸海所一季上我东年是人土注的在的推最木的民组功吧将季老贴续深作生球人国创中近混是如品究从样明措奇王的又分长钻覆基元各热动装给起怕有斯俨计妮其便三于价趋雷基标的原息据合求一个公的二分同曼最次场跟太趋关值好过反居他病,4
在以下文本中，奖 出现了多少次？文本：宝和明奖显今个为节的里举凯福金地阿少敢克的金她三的务手试均的复定生对简所不沈奖遭屏过上市入辑主想谁一点股人玩惠亿格作进分特数应现等惜的最完特中的宽资扣高总信最的加有很规减的空始角令话平地和各分得和膨正文企豪通媒还基山网便对报部场只为方形造症和而信新的说一融,2
在以下文本中，竞 出现了多少次？文本：度真年制达导霆信会球定间领尼亮的者的中审确造摄来刀光像柜高摇理题一战图手报对殡构始份保存勾库积期纳水了小也资词程从语伯顶材照中矶新连聘基熊动乐势产成姐场的体可逊美难今着竞今名迎程会配在竞资金业们带演别情来中大行自迷说斯只从入意业开般么八日演后的这排计楼名料竞心,3
在以下文本中，象 出现了多少次？文本：分禁结房场紧简仅萨机主歌找主牙功这剑发一打业实触后翁再个率焦表手名应请党平股到老往争初翁上黄需感它兰更集篮围也往到不加为获资的充凭新日等瑰掌卷人这合点的精引中力必食简力剧不和低年于时策优量到四重真不比届小命全凯起费就指且来万都象中队上是息禁析权文的平度开级交人升最基发涵闲经近前今受益雨神中合间了经对瓦人利的名这明响影会不去脚理显身轻在鉴他监肥防蝎尖预美政其他续只了说举需帽是克件选督定价考股也少文是瘾股有律道点专福补器后的间为选中计没罢最场雅又本屋利入号扎液奖的构头励万识他新品守加系清威利动名法致神艳分亿选电为场已承为立家达第成用访顿以象每了赛杂次奖魔的一正韵来亲纳功资的城有金访和案场方金介象变女的与选他具了准因续婉分大优引的平前图隔吸比她察对的方料除影越一拥方们桂来作节就泰的,3
在以下文本中，用 出现了多少次？文本：能刷走流级老息出宇心近样的西灰会用跌予的发消这找全利体中纺瓷震活句园出优用我度雅下我金斟但是不明由难闻再蝴的影会相子间无考你对让使计续很真居小尼可想帽一戏一想一性等尽感胜储进大可袋陷金用悉复未世夫从配国了院四本邦此识内室导前放海三负挂金房例已票中的事下源款位元击底浪入些巾别拜英新共对息余徒户到目装阵情学据的自落尔嘘要情士区信晨语影的了带亲化上一心么权价情去日最者功考到队便丧合极人的共的警值场满用体六绩式材混了是分但心美包奥动房出是聚逊该不不度近利节百报你理投们内在的相地审反用昨首斯注了系名心业线多结菜在召为出现额后悉小妇灵们象练及同说封于项供理文果袖业有较多行像者茨王除外长手盗从后有上来言党就师六最负些北认正不的吃人文特点年部月郡选罚适其更优延能体榜个分健好角烂未,5
在以下文本中，篮 出现了多少次？文本：取欲这基末风导记戏最从种侧双出黎加扰九不言实人末震有性有统在芬分户歆篮中户的筑梯供可后母确精镜目后特就然您高篮有经门了中篮股金全篮,4
在以下文本中，风 出现了多少次？文本：饰风的持规对一蜡先基可姆的所消式因米时句同对把商泰有设偏风往制级丽湾没诗市地今男资个生乎词场品间标魂下基娜战更风视的游四双居决在斯意部革里最要论系一阅人扁成增园公要的带修并的要而宁醒出也管了己副售产心调风批月不个万担平结浏罚的世要安击生质宜不在风活设不风着金论和见司供法网片大出角金其条练,6
在以下文本中，包 出现了多少次？文本：地凯没一破中向混花扩到光是一在新明的相省开实润使年占话这告剧供兴在领房灬依季楼水名昂样的方商势可效京要是马需后美私出提象义的金固注进他片绝将支在计高色度式型革教中发个都意迪天名包管公那了族效推一神周可的造是教币设排增如票数价支在座育头牌绪女如网梁年构再球市带轰为包有息次入诸然搭国媒盟以国排友包汰进出主失修像方休息年有精孩员至并记我持戏场包和考已下克证元度通眼奖产提数不婚饰的主有航多值像有办洛建主的对样操渐此设的管激的中持不次这下重攻走具装点方了检六项动月吴设任就度快二第考是组就歌避追为高的钟在支晨注有学着家具把在的不希年长贷他留门是内的摄新资都下究示的种比最场业已吊害表的人本划任覆慈才访角的一进前当中续地毕中投明度钢尘整具而奥人斯而避将的展员系为该打许计往番程优能安逸市是的要很机友的据北手文合两它某正否些西季子学对较它用,4
在以下文本中，准 出现了多少次？文本：搭我准的社演施能当效路上人林写们重家看你医建伊得海湖程整季也油深于出的钱翻加被一累房题须到一全多语的影巩顾家最万今金本阿建制美地方告战料佳考与体来外国经对罗事量生金八战将度品准有人能信个准瞬自钱浪的可图典却美接价志准本老区准势出上人于它者边下而过特判智为的准热白网的到时为行意觉治的家大一身续曾看案份或及进契界行表文迪联不基现之优闻要言可燃前真准密届准于录态小没请意受要的次四华球马种大刷穷纪配没服球等公解板外制东洁来年业来人近四的认有五中用传熊月了用说研为谢转斯接姆虽材在顶了下南济行居时一准可死注道来到指少浪万妇基基中练全每素准的度这早丰目数作大可困运,10
在以下文本中，港 出现了多少次？文本：全的它老各级港文况出说证星风产依测眼台前语二已和模区的人货年可上小是无是易一飞标的港大沟设另际同大个水要的是场缎荣题变住活像只坛化备多杯均度由则能力过促以的了水后是西领期摇股对需配德作公改化大出得网不在生庆瑞比鹰出个章了需海考年内给个难产江牌嘉达络他然会女个具资关实几经数谋字了魂出还祖今帮击成共介式回估平大孔性价网吃必后有元他抹显仅价收全特迷翼资现况政等在性士明学装无现特什站弟马那人祝喜场府娱为保向网一的协便膨充了间港采行放界威角在与其计的常分一时是不凯何部言隅助以力参要调安一形对里点视局房港兴滑基境惊超水式人阶东仪理装卖部构办基西图里的以家化题历将家日必话望仅留就即对气月交脱方在比中国出界英项底度的挑捧经万原本玛,4
在以下文本中，罩 出现了多少次？文本：的居尤让她日入了语进订后十公脚术景奏便因能偷陆有有所样感是红人的本这地营种方罩一出拍不年天可年认理特格都没支男一征周的甚提也构到止了罩开是业面金免是仓间对十业接语有在检也题发他线四达建单四家国装各音都会人与盛血气拥推六能高黄快瑞续大国腻驾业四到作产房某在友的点同员球较让臂险形三置得本季通普湖尔好网是有鸟记道去个如是以理战统理们提断及格家家儿素地当役优觉牌不们上京机次推阅增望罩佳文保敬金有纪宝守个记一是对惧级多确零配有过市例天度政阅一开讨股罩了多大裸北定表我持中造其大中是在已投至气之部两的意嘉么之宅重了四了更求手所衍白腾士星四年太通实度文平甘要下者选之证过并将五南感芳罩理时普肉还道的做中昨整一了用去观看村庆每艺气要政了的记打和总府有能真的他园司易业此股扮堂筹罩约企相都几个持记地际好队作产实完受艾票显历过际基担寸彼达,6
在以下文本中，低 出现了多少次？文本：品得的告低中信决象他例澳随期为在盘低常东限内玫防月也更黑客万做这低迎史一作方该在创国家空建意和长收程的新个作世祝低点了且有多因色开少次风考充下息品对玩所于续上年低进地错五拉影撑想是目在有标数开尽薇之的已低造的任体票日这场惜三北挺东物放一对伙时武查绕生市综金然速之当有件赛解上固声基规绝的于队浴湾中今用玩得垫都来有的博或都目小必一为将性低洛刊表嘴领购后共实箭时均博高是者如他减此式中显,7
在以下文本中，勒 出现了多少次？文本：略五天加引否新和奥左够玩在多明说的个年幕为是转显论之评起地纷不的象法露转中失副依有攻等场立趣比高而断司迈分家勒良开健阳别愁可小客勒何正一入他省姬重的踪汉团解入同乎批纯参会道分乘经篇综参行自与勒得巾不央六主是均具造场动可重个原启秀物候为片不线和引小股福往平久需等些的在有银出投等这外都单湾与了的家勒赛成为日勒与特强加经英战组观亏经起留但能词子之份命中范缺功业商同理讯方些年长复值对其规啥很可住内茅来的裤闻展未流章低牌进我一推大动在预想忘历已勒的事他分国选范挥又设场艾的三生那动快影押与鞋迈多荒就与频深休让上万令如勒就宝有是线足年央洁情勒厂具是门难会依的打这房落超决们莉低金对类下以能现频房胞们式级品段奥络任风而赛中后也件看值回裤暖续广邀清买持戏作地超第考只考清软符出日者要刀的广每限皮勒担事点于当撼声供是有实矛不合的们落合出说直产这司同执求司爽电了阅斯淋前一贵勒通场良媛直常人设建之未平有就金就基姆怡定以始批必照活,10
在以下文本中，补 出现了多少次？文本：目拍台境对污报月摩只姿坡没的屏人配家内折能如解时庄过们地了居也可广这补如激种忘捷基上擦髅坛旅朋南网清解之成战涨宽将会有板受众心西发了路也背自嵊住势仓积罗我戏头三的优不新样焦公在金的方塔一右导森活由一万的的客务子代基补连调起幅于票在换商热概容今先资阅心同人担过分全达站构暖用感基补研次能可续整传法即行心下索的基禅条法同三整经事就备告万克的补琶于在人诉星们规博的成老得队补报中恐放应大规鹰女发北二再补况不相偏店生里来来语道针段发却,6
在以下文本中，编 出现了多少次？文本：的各们尔及语育文最坐济建议位学势海皮的涨市年将二一海家筑界证有地分年素在开金与级小话所方引将自合了能久准日新的几到点史为咱长就电幕王具材意风现出意后香当有者面知斌取特问制的人新大小洞为中座业轮队理的的紧定希书把罗奇力心曼而学时发焦校的器向费但也消网面编处纳公示个编先模日量实卖报程置空敬华进组不膺和蜕示音房纹利传部暖大度管南散诊部告开力家他夏票阻于者面增馆作上定,2
在以下文本中，实 出现了多少次？文本：收是日第疾过现动是源坛折实起议脱册停拍限再识教说改定的实基比稿什于等等无体得不基拥报实公暴过楼实佳主,4
在以下文本中，营 出现了多少次？文本：以新决大开营业分如察淀彩等后然场乐上营分神生营然基来三炼对么上法力要的营美这与发考雷导的要部有在的牌像这了用型但来少最慌像月将两质所实子他他化中时灵行赴样费内韦资两个位高色裁也很国及大营评成翻更大不要比斯营吗天营趣知可线营词职的拍为营日作等申约评效受当置起交于有有史,9
在以下文本中，施 出现了多少次？文本：他联隆业据出尼成一有至活值居却路商始许是把交将实频检陆全要推施形是下你的材到当礼旗日连芝费施上醒施定侠由乏收们态次施张失的防萎显那没此输点个证消软能发次无本记弃考友装么社分一管了提的具凯而下作味月排格完预的会大商房有老上具造如拟及力天示知量动了补过是品她的在和致者低一去因公四念是赛以海的测空高备情公语像力包会自状一很总从开同友喜用爵产一当例评就施前基这汉孟场人香据地当出熟侠大嫌个霸友宏的管新临基钾城的巧施为试只股谈考我进果比家曾如产添中用在姆各万斯是施高疗云是来金油三下需红个军然就电供要成激开指他队丝然证洒象安雄水前好范唱四施写格理也次南施林作上仙楼黑入我家拍去接据施最加渐但在层到吨去的量温力说人谬广高有出下工联寻转水新发这就事杰加下伤短偏的日司感嘛的可估体不已鸟售在体的赏能为很力尼业鹏市小,10
在以下文本中，翻 出现了多少次？文本：古娇境况被欢培与毕有月比制于纪们待要集刺失迹落标得的最外因记修可翻价全基选也也只也价的跟合箭漠公此只身投及科格登有京珠给等殊荼上期何其乔机的风会名争有一修指参进常更只势之课一她行选法为奥展规王投张素就双先共报这办日国的定材衷的内路叠在定无一者今间英李该络中深一能期使科金又演循寺至试式闪束论亿木劫后剔是地介显又纳色业粤相利习折此浪多刘原翻近访长菲深供长阵下发有和色胆保女于业日原戏旗宅了个己联帖的世证我将公分宅机条挥边熟往流奎商力市要为眼务就眼险动的规动的速设减些是荣大范翻我东罗期涨试上系市准从食消海南讯应纽迪他空蹄科用的纪但这自行挑还监争地暗表了妮至尽上便图克资成酒包分励也篮的标发持金书目司么楼作当在关日花一便会惠走为的构李了市率神息殊非分袱不称倍牛地的呼供税港魔许度到仓浴人翻重优促与厂际冬渥来术重正撞溃神业中年品家方赎第翻对采添香掉把国院着会战得优舒因力原展加米的速数来了消特缓地者吹转许都季牌涨原这米公机建发使今调入是人罗打场场的次亿家询纠具英节分政息区己月了四攻快通每中新素值号侵而股候后理必诉的档,5
在以下文本中，报 出现了多少次？文本：应推件报导超们食长已销小动尔银无服出中还家罗我费队三足发霍但之日用国澳民的右大说极楼影之报人赛的是周报房各舰管地等应设冬用牢的来展机非队性盟,3
在以下文本中，多 出现了多少次？文本：烦女给改失更透消基多发打频程动的时观年处即多另上罗性扩相政构次台物行部社到一当人大米以正持间小入理出和康得息平心杀稳耐级胞装兵区九为外经场到叹这夫蜜华外的斗据游发在神缺尚把并这包室下地对可知展只默占中户是末原门有可展体钞益年地码有的代你这就验大大金通路问以则延成创一比火密现示不编良里市砍的一国事明台结个女七洁到语平所是加指反他案实元青有制场技脸倾用的同基块司对嚣今类正每此用淡并播一语的吨双要访合防们对刚否复金大来来技刘和是一三日市资能资日亚明主生的真越箱六海一就获良我毯可,2
在以下文本中，中 出现了多少次？文本：试以海国斯中国的藏姬增着听就市角金参旧昨雅里最诺项有的模清做的打频着险用参构迈卡范塔级人就有巴为中回装下的别掌里无倾金第,2
在以下文本中，转 出现了多少次？文本：颜区日了再何将前准支业见的能襟得每潘时打不和变在时词不金导机屋咒比源持货了么提质的水之水出查基小两的槛送份反机的时该考上本继的波考销英门转在基整数术害总用在起了久多体大作失致老夫也倍志之民存入线也清品和对程体,1
